{
  "schema": "lens_bundle.v1",
  "lens_id": "lens_02_method",
  "lens_type": "method",
  "lang": "ja",
  "targets": [
    {
      "label": "中華",
      "items": [
        { "patterns": ["炒", "爆", "中華炒め", "強火", "揚げ（中華）"], "weight": 2.0 }
      ]
    },
    {
      "label": "和食",
      "items": [
        { "patterns": ["煮付け", "炊き", "和え", "だし", "照り焼き"], "weight": 2.0 }
      ]
    },
    {
      "label": "洋食",
      "items": [
        { "patterns": ["ロースト", "ソテー", "煮込み", "オーブン", "グリル"], "weight": 2.0 }
      ]
    }
  ]
}